asin,title,media_util
0800629779,Competency-Based Counseling: Building on Client Strengths (Creative Pastoral Care and Counseling Series),1.0
3895088994,Mercedes (2-Volumes in 1 Book),1.0
0735103488,The Life of Sir William Osler,1.0
0809016109,Unwinnable Wars: American Power and Ethnic Conflict,1.0
0064440451,Morris Goes to School (I Can Read Book 1),1.0
076442095X,Instant Skits for Children's Ministry,1.0
B00000K2C9,Jazz Steppin',1.0
0789720817,Official PrintMaster Guide (Que-Consumer-Other),1.0
0226519996,"A History of the Federal Reserve, Vol. 1: 1913-1951",1.0
B00004TREJ,The Mercury Years,1.0
